{
  "$schema": "./catalog.schema.json",
  "version": 1,
  "generated_at": "2026-09-19",
  "notes": [
    "Single source of truth for biome families. Consumers: tools/landmark-factory (landmarks, props, terrain_piece), tools/creature-factory (palette.creature), prototypes/world-lab galaxy.ts (terrain_kinds, marker, growth_hero, catastrophe, palette.night).",
    "Derived fields (creature contrast_vs_ground, terrain_kinds[].tint or tint_hsl_offset) are recomputed by assets/biomes/validate_catalog.py; edit either side and run --fix.",
    "The seven shipped families keep their asset ids and landmark file names from assets/landmarks/manifest.json byte for byte."
  ],
  "conventions": {
    "units": "metres, +Y up, base on y=0",
    "contrast": "WCAG relative-luminance ratio (L1+0.05)/(L2+0.05); creature body colours must be >= 1.4 against palette.ground",
    "tint_hsl_offset": "hue in degrees (-180..180), saturation and lightness as absolute deltas in 0..1; tint = ground shifted by the offset",
    "density": "decor count for a reference topic cell of angular radius 0.24 rad on the 70-unit planet (matches galaxy.ts)",
    "profiles": {
      "flat": "no relief",
      "gentle": "soft slope down to a neighbour (shore)",
      "hills": "rolling bumps 0.6-1.4",
      "mountain": "peaks 1.8-3.2 with a cap colour",
      "recessed_water": "bowl below base; fill = water | lava | ice | none",
      "terrace": "raised flat plateau with a rim step"
    },
    "galaxy_profile_map": {
      "flat": "flat",
      "gentle": "slope",
      "hills": "hills",
      "mountain": "peaks|volcano",
      "recessed_water": "water|crater",
      "terrace": "raised"
    },
    "landmark_heights_m": {
      "s1": [
        0.55,
        0.62
      ],
      "s2": 1.0,
      "s3": 1.8
    },
    "triangle_budgets": {
      "landmark_s1": 400,
      "landmark_s2": 900,
      "landmark_s3": 1600,
      "prop": 300,
      "terrain": 1600
    },
    "growth_bands": "percent of course progress: 0, 25, 50, 75, 100; height_m_by_band is the hero's world height (before PROP_SCALE)",
    "night": "driven by the page colour scheme: prefers-color-scheme dark = night. palette.night overrides sky/fog/lamp/window and adds family extras"
  },
  "archetypes": [
    "blob",
    "bean",
    "bird",
    "biped",
    "sprite",
    "flat"
  ],
  "shared_props": [
    {
      "id": "shared-rowboat",
      "brief": "flat-bottom rowboat with two seats, coral stripe",
      "tri_budget": 120,
      "runtime_recipe": "boat"
    },
    {
      "id": "shared-dock",
      "brief": "plank dock on four posts, 1.2 m",
      "tri_budget": 100,
      "runtime_recipe": "dock"
    },
    {
      "id": "shared-peak",
      "brief": "faceted mountain peak with a snow or stone cap chosen by the family's terrain kind alt colour",
      "tri_budget": 120,
      "runtime_recipe": "mountain"
    },
    {
      "id": "shared-pillar",
      "brief": "broken stone column with a capital",
      "tri_budget": 60,
      "runtime_recipe": "pillar"
    },
    {
      "id": "shared-tower-block",
      "brief": "box tower with lit window facets, family accent roof",
      "tri_budget": 90,
      "runtime_recipe": "tower"
    }
  ],
  "families": [
    {
      "id": "forest",
      "display_name": "Forest",
      "status": "shipped",
      "mood": "Soft green hush under round canopies; a place that grows while you are not looking.",
      "palette": {
        "ground": "#8fc48a",
        "ground_alt": "#6fa86a",
        "accent": "#4f8a4a",
        "road_core": "#c9b08a",
        "road_edge": "#8f7a5a",
        "water": "#5fa8c9",
        "window": "#ffe9a8",
        "ink": "#3a2f45",
        "creature": [
          {
            "name": "cream",
            "hex": "#f2e3c6",
            "contrast_vs_ground": 1.589
          },
          {
            "name": "cocoa",
            "hex": "#8b5a3c",
            "contrast_vs_ground": 2.877
          },
          {
            "name": "brick",
            "hex": "#d9765c",
            "contrast_vs_ground": 1.558
          },
          {
            "name": "violet",
            "hex": "#9b78c9",
            "contrast_vs_ground": 1.761
          }
        ],
        "night": {
          "sky": "#1d2a3a",
          "fog": "#2a3f48",
          "ground_lightness_offset": -0.22,
          "lamp": "#ffe9a8",
          "window": "#ffe9a8",
          "star_density": 0.5,
          "moon": true,
          "fireflies": true,
          "canopy_emissive": "#3f7a3a"
        }
      },
      "terrain_kinds": [
        {
          "id": "grove",
          "profile": "hills",
          "tint_hsl_offset": {
            "h": 0.0,
            "s": 0.0,
            "l": 0.0
          },
          "tint": "#8fc48a",
          "alt": "#6fa86a",
          "decor": [
            {
              "prop": "forest-round-tree-small",
              "density": 16
            }
          ]
        },
        {
          "id": "pine forest",
          "profile": "hills",
          "tint_hsl_offset": {
            "h": 6.3,
            "s": -0.074,
            "l": -0.061
          },
          "tint": "#7db27e",
          "alt": "#5f9660",
          "decor": [
            {
              "prop": "ice-pine-snow",
              "density": 22
            }
          ]
        },
        {
          "id": "clearing",
          "profile": "flat",
          "tint_hsl_offset": {
            "h": -9.8,
            "s": 0.093,
            "l": 0.067
          },
          "tint": "#a9d69a",
          "alt": "#8fc48a",
          "decor": [
            {
              "prop": "meadow-flower-clump-peach",
              "density": 14
            },
            {
              "prop": "meadow-bush",
              "density": 4
            }
          ]
        },
        {
          "id": "hills",
          "profile": "hills",
          "tint_hsl_offset": {
            "h": -5.8,
            "s": 0.028,
            "l": 0.016
          },
          "tint": "#98c98d",
          "alt": "#8b7a70",
          "decor": [
            {
              "prop": "forest-round-tree-large",
              "density": 5
            },
            {
              "prop": "forest-rock",
              "density": 4
            }
          ]
        },
        {
          "id": "lake",
          "profile": "recessed_water",
          "tint_hsl_offset": {
            "h": -4.7,
            "s": 0.059,
            "l": 0.037
          },
          "tint": "#9ccf92",
          "alt": "#5fa8c9",
          "decor": [
            {
              "prop": "shared-rowboat",
              "density": 1
            }
          ],
          "role": "water",
          "fill": "water"
        },
        {
          "id": "swamp",
          "profile": "recessed_water",
          "tint_hsl_offset": {
            "h": -4.6,
            "s": -0.11,
            "l": -0.092
          },
          "tint": "#7fa877",
          "alt": "#587f5f",
          "decor": [
            {
              "prop": "meadow-bush",
              "density": 8
            },
            {
              "prop": "forest-log",
              "density": 3
            }
          ],
          "fill": "water"
        },
        {
          "id": "orchard",
          "profile": "flat",
          "tint_hsl_offset": {
            "h": -15.5,
            "s": 0.07,
            "l": 0.031
          },
          "tint": "#a5cf8f",
          "alt": "#8fc48a",
          "decor": [
            {
              "prop": "forest-round-tree-small",
              "density": 14
            }
          ]
        },
        {
          "id": "cliffs",
          "profile": "mountain",
          "tint_hsl_offset": {
            "h": -1.5,
            "s": -0.108,
            "l": -0.053
          },
          "tint": "#88b083",
          "alt": "#8b7a70",
          "decor": [
            {
              "prop": "shared-peak",
              "density": 4
            },
            {
              "prop": "ice-pine-snow",
              "density": 6
            }
          ]
        },
        {
          "id": "shore",
          "profile": "gentle",
          "tint_hsl_offset": {
            "h": -13.8,
            "s": 0.043,
            "l": 0.045
          },
          "tint": "#a8cf96",
          "alt": "#5fa8c9",
          "decor": [
            {
              "prop": "shared-dock",
              "density": 1
            },
            {
              "prop": "forest-rock",
              "density": 4
            }
          ],
          "role": "shore"
        }
      ],
      "marker": {
        "tier_colours": [
          "#6fa86a",
          "#8fc48a",
          "#a9d69a"
        ],
        "signature_props": [
          "forest-round-tree-small",
          "forest-mushroom",
          "forest-log"
        ],
        "creature_archetype_preference": "bean",
        "sign_text_style": "carved wood plank"
      },
      "landmarks": {
        "s1": {
          "name": "stump with sprout",
          "brief": "cut stump, one two-leaf sprout in the centre",
          "height_m": 0.58,
          "motif_carried": "sprout",
          "file": "assets/landmarks/forest/forest-landmark-s1.glb"
        },
        "s2a": {
          "name": "treehouse",
          "brief": "round canopy with a plank hut and ladder; sprout leaves become the canopy",
          "height_m": 1.0,
          "motif_carried": "sprout -> canopy",
          "file": "assets/landmarks/forest/forest-landmark-s2.glb"
        },
        "s2b": {
          "name": "mushroom cottage",
          "brief": "coral cap cottage with a stump doorstep",
          "height_m": 1.0,
          "motif_carried": "stump -> doorstep",
          "file": "assets/landmarks/forest/forest-landmark-s2b.glb"
        },
        "s2c": {
          "name": "hunter's lodge",
          "brief": "stone-and-log lodge with antler sign and a sapling by the door",
          "height_m": 1.0,
          "motif_carried": "sprout -> sapling",